{
  "trip_id": "t_kyoto",
  "style": "vlog",
  "context": {
    "destination": {
      "country": "Japan",
      "city": "Kyoto"
    },
    "trip_type": "City break",
    "start_date": "2026-10-20"
  },
  "clips": [
    {
      "clip_id": "c_01",
      "recorded_at": "2026-10-20T09:12:04Z",
      "duration_s": 52.4,
      "has_audio": true
    },
    {
      "clip_id": "c_02",
      "recorded_at": "2026-10-20T11:40:31Z",
      "duration_s": 47.0,
      "has_audio": true
    },
    {
      "clip_id": "c_03",
      "recorded_at": "2026-10-20T15:05:12Z",
      "duration_s": 61.8,
      "has_audio": false
    },
    {
      "clip_id": "c_04",
      "recorded_at": "2026-10-21T08:30:00Z",
      "duration_s": 45.9,
      "has_audio": true
    }
  ]
}
